claim_id,claim,date_published,explanation,fact_checkers,main_text,sources,label,subjects
29319,"A photograph shows people lining up outside a Houston, Texas shelter to turn in unwanted animals to be euthanized.","June 29, 2017","What's true: It's statistically likely that around three quarters of those photographed with animals were turning in stray or unwanted animals. What's false: The vast majority of animals turned in to this particular shelter are not put down. Statistically, only around 14% of animals in the photograph were likely to end up being euthanized.",Dan MacGuill,"On 27 June 2017, the Facebook page of the “Special Needs Animal Rescue and Rehabilitation” organization (also called SNARR) posted a photo of people with animals lining up outside a Houston, Texas animal shelter, purportedly to surrender the pets and have them put down:  This is the line at the Houston, Texas city shelter today to surrender animals. These dogs and cats are about to be DUMPED to face a death sentence. SNARR’s Facebook post was subsequently picked up by One Green Planet web site, whose article about the topic was headlined: “[What the Hell]!? People are Literally Lining Up to Dump Their Pets Before July 4th Weekend.” The Pet Rescue Report got in on the action as well, writing: “Heartbreaking Reality: Owners Line Up at Shelter to Surrender Their Pets Before July 4th Parties.” The Facebook post was removed on 1 July 2017, but had been widely shared, and some commenters began to question the sourcing and veracity of the claim that the owners shown in the photo were all in line to surrender their dogs. Many suggested that the demeanor of some of those in line was not indicative of giving up their dogs, and speculated that it was more likely to be a line for wellness checkups. Beforing removing it, SNARR had edited its original post, specifying that the two men shown in the immediate foreground of the photo left the line in order to have a wellness check-up for their pet, but still suggesting that all the others (around a dozen in the photo) were there to surrender theirs. We tracked down one of those men, Juan Martinez of Houston, Texas, whose identity we were able to verify. Martinez told us that he and his brother-in-law (also pictured), had visited the Bureau of Animal Regulation and Care (BARC) animal shelter on Carr Street in Houston on the afternoon of 27 June 2017. We were able to find documents showing that Martinez was there to have his mother’s newly-fostered kitten spayed and given deworming treatment. Contrary to what the group claimed on Facebook, Martinez said everyone waited in the same line, regardless of the purpose of their visit. Although he did not speak to anyone else in line, apart from his brother-in-law, he told us there was a positive atmosphere in the line, and that it was his impression that “nobody was there to drop [their pets] off.” A SNARR spokesperson told us that the organization’s treasurer took the photo at around noon on 27 June 2017. The group’s treasurer was there to help a friend look for a lost dog. The viral Facebook post was written by SNARR’s president, Lauren Connolly. Soon after the picture in question was taken, the shelter staff came out to ask people the reasoning for their visits (in order to bring in the wellness clinic visitors). The only people who stepped out were the two gentlemen with the cardboard carrier at the back of the line and the member of Snarr’s board, which [sic] were then brought to a different entrance. The rest were surrenders – whether it was owner surrenders or stray surrenders (stray being once someone’s pet – either that had been lost or that has been abandoned), we do not know. We asked SNARR how its treasurer found out that all the remaining visitors to the shelter were there to surrender pets. The group’s spokesperson said: Our treasurer did not affirm with each person if they were there to surrender. Conversations overheard in line and with the shelter staff that [sic] led the wellness clinic visitors out of the line and to a different entrance implied that. After publication of this article, SNARR’s treasurer contacted us to make clear that they had not taken the photo with the intention of it being published or used in the way it was. As of 1 July 2017, the treasurer had left SNARR, in response to the episode. A spokesperson for the Houston shelter explained the queuing system in place at the center. Their explanation contradicts some of the claims made by SNARR. According to BARC, everyone visiting the shelter stays in one line until they come through the front door. At that point they are asked the purpose of their visit, and triaged into three or four separate lines (one for the wellness clinic, one for the foster clinic, one or two to turn in stray or unwanted dogs.) This means that, in theory at least, any given group of people waiting outside the shelter would be there for a variety of reasons. The spokesperson told us that on 27 June 2017, the center offered the following services: adoptions, intake (stray and unwanted animals), a pet wellness clinic, foster clinic, and spay/neuter clinic. On that day, the shelter saw: 23 adoptions, 33 transfer/rescues (animals given to local rescue partners, who later adopt them out to the public), three lost dogs returned to their owners, seven dogs fostered out. 102 animals were turned in as strays, 52 dogs were surrendered by their owners, and 57 people visited the foster or wellness clinic with pets. Of the 211 cases where people brought animals to the shelter that day, 27% were visiting the foster or wellness clinic, and 73% were turning in dogs — either strangers presenting lost or stray dogs, or owners surrendering their pets. So it is statistically likely that about three-quarters of any given group waiting in line with animals outside the shelter that day, were turning in stray or unwanted dogs. So does this mean that all, or even most, of these dogs will be euthanized? No. SNARR’s Facebook post describes, in very emotive, even disturbing terms, the fate that supposedly awaits the animals seen in the photo: They’ll be dragged from the person they love, the person that swore to love and care for them for the duration of their lives. They’ll be confused, sad, but most of all terrified. The smell of death is overpowering here. After a day or two of sleeping on cold, dirty floors with the cacophony always all around, shivering and scared, they’ll be walked down a long hall to a room. A needle will slide into their veins and they’ll slip away, wondering where their beloved human is and why they never came back. All the while, their human is probably kicking back at the beach for the 4th of July weekend. Only 52 out of 211 animals (25 percent) brought to the shelter that day were brought by their owners, to be surrendered. Almost twice as many (102) were strays or lost dogs being brought to the shelter. And finally, more than 80 percent of dogs turned in to the BARC shelter — for whatever reason — are not put down. The shelter’s spokesperson provided us statistics showing that in 2016, 80.4 percent of animals turned in (either as strays, lost dogs, or by their owners), were successfully adopted out, returned to their owners or otherwise kept alive. (There is a sliver of irony in this episode. Juan Martinez, who was in the photo that accompanied Snarr’s inflammatory Facebook post, was bringing a fostered kitten to BARC for medical care. That kitten was once a stray, and could well have been turned in to the shelter by someone who once waited in line outside, just like those in the photo.) The percentage of dogs euthanized was 19.6 percent. Since the total number of dogs turned in on 27 June 2017 was 154, we can estimate that about 30 (19.6 percent) of these will end up being euthanized. And since the total number of animals brought to the center (including the medical and foster clinic) was 211 — this means only around 14 percent will end up being put down. In other words, the statistical likelihood is this: Of the animals waiting outside the BARC clinic at any given moment on 27 June 2017 — the day this viral photo was taken — the vast majority (around 86 percent) were likely not to end up being euthanized.","http://www.houstontx.gov/barc/ataglance/At%20A%20Glance%20Calendar16.pdf, http://archive.is/jvpfN, http://archive.is/o1rnC, http://www.houstontx.gov/barc/",false,"Viral Phenomena, animal shelters, animals, cats"
33541,Hillary Clinton supported and helped free two Black Panthers accused of torturing and murdering Alex Rackley.,"June 30, 1999",Did Hillary Clinton support and help free two Black Panthers accused of murder?,David Mikkelson,"It’s difficult for those who weren’t around to experience the 1960s first-hand to fully understand the controversy that swirled around radical parties such as the Black Panthers. Certainly many Americans viewed them as representing the very worst of that era’s political movements: a group of hate-filled militant thugs who felt their disaffection with the existing social and political systems justified anything required to achieve their aim of “revolution by any means necessary” (such as smuggling guns into a Marin County courtroom in an attempt to free Panther George Jackson, resulting in a shoot-out that killed a judge, two inmates, and Jackson’s brother). Others at the time, however, believed the Panthers were the only political group that truly represented a downtrodden and marginalized group of people who had been enslaved, discriminated against, and denied civil rights protections for hundreds of years; that sought to improve the condition of the poor by operating schools, opening medical clinics, and providing free breakfasts for ghetto children; and that had the courage to stand up to the brutality visited upon them by law enforcement acting in the service of a government and a society that sought to “keep them in their place.” In May of 1969, Black Panther founder and national chairman Bobby Seale (who had already been indicted for his alleged participation in demonstrations at the Democratic National Convention in Chicago in August 1968) made a trip from Oakland to New Haven, Connecticut, to speak at Yale University. The Black Panthers were by then nationally known, a focus of media attention, and under the active surveillance of the FBI. (J. Edgar Hoover had publicly declared several months earlier that he considered the Panthers “the greatest threat to the internal security of the country.”) Rumors of police informants and government spies having infiltrated the party were rampant, and a man named Alex Rackley, a member of the Panthers’ New York chapter, fell under suspicion. Rackley was taken to the home of Warren Kimbro (described as a “community organizer and aspiring Panther”) where he was held captive for 24 hours, beaten, and scalded with boiling water in an effort to force him to confess. Rackley was then taken to a marsh in Middlefield by Kimbro, George Sams (a Panther field marshal and, according to some, himself a police informant), and Lonnie McLucas (a Panther member from Bridgeport), where Sams ordered Kimbro and McLucas to kill the suspected informant. (Who did the actual killing has always been disputed: McLucas reportedly fired the first shot, but Kimbro admitted to delivering the bullet to the head that killed Rackley.) Rackley’s body was discovered the next day by fishermen, and fourteen Black Panthers were arrested and charged with murder, kidnapping, and conspiracy, and nine of them were indicted. The subsequent murder trials of Black Panthers that took place in New Haven beginning in 1970 was a cause célèbre, the latest “trial of the century” that pitted the “establishment” against the “radicals”: the former supposedly valiantly defending the values of mainstream American society, while the latter were supposedly being framed and railroaded by government powers determined to destroy them at any cost. Upwards of 12,000 Black Panther supporters made their way to New Haven, and many of them were housed and fed in and around the campus of Yale University. Classes at Yale were made optional for the last few months of the term as Panther supporters swarmed the campus in protest and the president of Yale University, Kingman Brewster Jr., announced: “I personally want to say that I’m appalled and ashamed that things should have come to such a pass that I am skeptical of the ability of Black revolutionaries to achieve a fair trial anywhere in the U.S.” From that maelstrom came the 1999 political piece reproduced above, which claims that two 1990’s political figures, Hillary Clinton (then First Lady) and Bill Lann Lee (former acting head of the Justice Department’s civil rights division whose appointment by President Bill Clinton was controversial because of Lee’s support for affirmative action programs),  defended the Black Panthers, helped “shut down” Yale University, and aided the accused Panthers in going free or serving lenient sentences. But all of that is gross exaggeration: neither Clinton nor Lee did any of those things, and any involvement they had with the New Haven Black Panther trials was extremely minor and tangential. We’ll begin with the last part, the claim that “These two people actually went so far as to shut down Yale University with demonstrations in defense of the accused Black Panthers during their trial.”  This statement is ridiculously far-fetched: Yale University went to a “voluntarily optional” class schedule (it did not “shut down”) for a few months at the end of the term in mid-1970 because thousands of Black Panther protesters had flooded the campus and its environs, not because of anything Hillary Clinton or Bill Lee did. And while the Panthers made have found many sympathetic supporters among the student body at Yale, neither Hillary Clinton or Bill Lee led or participated in  student demonstrations in support of the Black Panthers, or spoke up in their defense. The above-quoted article also asks “How in the world do you think that these killers got off so easy? Well, maybe it was in some part due to the efforts of two people who came to the defense of the Panthers.”  But neither Bill Lee nor Hillary Clinton “defended” the Panthers, either in a public or a legal sense. Bill Lee wasn’t a lawyer, or even a law student; he was simply another Yale undergraduate who had no involvement in the Black Panthers’ trial. Hillary Rodham (as she was known then) wasn’t a lawyer then, either: She was a Yale law student, and like many of her politically-minded fellow law students who saw the latest “trial of the century” taking place just outside the main gate of their school, she took advantage of an opportunity to be involved in the case in a minor, peripheral way by organizing other students to help the American Civil Liberties Union monitor the trials for civil rights violations. Her tangential participation in the trial in no way helped “free” Black Panthers tried for the murder of Alex Rackley In fact, the killers of Alex Rackley didn’t “go free”: Lonnie McLucas was found guilty of conspiracy to commit murder and sentenced to twelve to fifteen years in prison,  and Warren Kimbro and George Sams turned state’s evidence and pleaded guilty to second degree murder, serving four years in prison. Bobby Seale and Ericka Huggins (who were accused not of killing Rackley, but of being present during his captivity and boiling water to torture him with) went free not due to any efforts on the part of Hillary Clinton or Bill Lee, but because the state failed to sufficiently prove its case against them: the jury deadlocked in favor of acquittal for both defendants, and the trial judge dismissed the charges against both of them. And, of course, neither Hillary Clinton nor Bill Lee had anything to do with the post-trial lives of Seale and Huggins."," ",false,"Uncategorized, black panthers, hillary clinton"
37784,A painting depicting J. Marion Sims' experiments on enslaved Black women is on display at the Alabama state Capitol.,"June 22, 2020",Is There a Painting of J. Marion Sims’ Experiments on Black Women at the Alabama State Capitol?,"  Arturo Garcia  ","Amid the removal and re-evaluation of statues commemorating historical figures in June 2020, a Facebook post that spread widely in June 2020 conflated a statue of a gynecologist who experimented on enslaved Black women with a painting depicting him alongside one of those women.The post by comedian Earthquake (a.k.a. Nathaniel Stroman) features a cropped photograph of the painting, which depicts Sims and two other men observing a woman identified as Lucy. Stroman’s post, which has been shared more than 70,000 times on Facebook, states:This painting hanging in the state capital of #Alabama take a long look at it. #JamesMarianSims – who perfected his surgical techniques by operating Without anesthesia on enslaved #blackwoman because he believed black women Didn’t Feel Pain. he described the experimental surgeries on his enslaved subjects as “So painful, that none but a woman could have borne them. After perfecting the techniques on black enslaved woman with out anesthesia in America, Sims went on to offer the procedure in Europe to wealthy white women who were sedated. This man is arguably the most famous American surgeon of the 19th century. I see him no different than Josef Megele both pure monsters.I hope everyone who goes to the gynecologist will close their eyes for a moment and honor these enslaved black women. I cannot, Cannot fathom the pain these black women endured under this man’s hands. And that painting…. who should be honored? The irony is also in their clothes. Some people, society look at people’s status, respect even on how one is dressed. The one who should be honered and respected is the one who owns no shoes.There is no record of the painting being on display at the Alabama State Capitol building. The full version of the painting shows Sims standing in front of Lucy, while two other women identified as Anarcha Westcott and Betsy watch from behind a makeshift curtain:Robert A. Thom’s painting is part of the series “Great Moments in Medicine,” which he did on commission by the pharmaceutical company Parke-Davis & Co. between 1948 and 1964. In 2007 Pfizer (which had acquired the collection of 45 paintings after buying out another company, Warner-Lambert) gave it to the University of Michigan Museum of Art, where they have been archived.The accompanying text for the painting, composed by Parke-Davis pharmacist George A. Bender, reads:Little did James Marion Sims, M.D., (1813-1883) dream, that summer day in 1845, as he prepared to examine the slave girl, Lucy, that he was launching on an international career as a gynecologic surgeon; or that he was to raise gynecology from virtually an unknown to respected medical specialty. Nor did he realize that his crude back-yard hospital in Montgomery, Alabama, would be the forerunner of the nation’s first Woman’s Hospital, which Sims helped to establish in New York in 1855. Dr. Sims, who became a leader in gynecology in Europe as well as in the United States, served as president of The American Medical Association, 1875-1876; and was honored by many nations.However, the museum’s description of the piece adds more context:By way of blinded valorization, Bender’s text sterilizes Sims’ years-long experimentation on the bodies of “Anarcha, Betsy, Lucy and about nine other unidentified enslaved women and girls” from 1844 to 1849. Eclipsed by Bender’s mythical-heroic account of Sims was the agonizing pain suffered by the patients experimented on before the wide use of anesthetics. At the same time, the enslaved labor responsible for the very construction of Sim’s “crude back-yard hospital” is rendered invisible. As Bender drew heavily upon Sims’ memoir to craft his captions, he, much like Sims, also failed to acknowledge the fact that the enslaved female patients were expected to continue their servitude even as patients. These women not only cooked, cleaned, and cared for the Sims family, but effectively kept the Alabama hospital running, serving as Sim’s surgical nurses throughout the five-year period of their “treatment.”Like Bender’s caption, Thom’s illustration also lionizes Sims, who stands with his arms folded at the head of the hospital scene. The illustration reproduces a racist, medical gaze, as it prompts the observer to join the ranks of other visiting surgeons who ogle Lucy as a medical object of curiosity. Through proper contextualization and careful visual study, we might challenge this supposed “great moment in medicine” and consider the contradictions of “scientific achievement” and the entanglements of violence, slavery, and medicine.While there is no record of the painting of Sims and Lucy being displayed at the Capitol, a separate painting showing Sims standing near Westcott and calling him one of the “medical giants of Alabama,” was on display at the University of Alabama-Birmingham before being removed in 2006. In 2017, Dr. Vanessa Gamble — a physician and historian at George Washington University — reaffirmed in a radio interview that Sims performed thirty surgeries on Westcott alone in the course of his experimentation, which was conducted without anesthesia:There was a belief at the time that black people did not feel pain in the same way. They were not vulnerable to pain, especially black women. So that they had suffered pain in other parts of their lives and their pain was ignored.Sims is credited with discovering a surgical technique that could repair the condition known as vesicovaginal fistula, as well as the first successful gallbladder surgery, and the first artificial insemination procedure that resulted in a pregnancy, although it resulted in a miscarriage and was described by The Atlantic as “an ethical nightmare.”While there is no painting of Sims at the Alabama State Capitol, a statue of him first erected there in 1939 still stands, despite calls for its removal. A separate statue honoring Sims in New York City was taken down in April 2018. A separate monument to Sims is still on display outside the State House in his native South Carolina.Comments","https://news.umich.edu/a-major-gift-of-art-and-history-u-m-receives-45-significant-medical-paintings-from-pfizer/, https://www.linkedin.com/cws/share?url=https%3A%2F%2Fwww.truthorfiction.com%2Fj-marion-sims-painting-alabama-capitol%2F, https://www.theatlantic.com/health/archive/2016/01/first-artificial-insemination/423198/, https://www.theguardian.com/artanddesign/2018/apr/21/j-marion-sims-statue-removed-new-york-city-black-women, https://www.facebook.com/RealEarthquake/posts/10158971250099467, https://www.wuwm.com/post/remembering-anarcha-lucy-and-betsey-mothers-modern-gynecology-0#stream/0, https://www.truthorfiction.com/columbus-police-accused-of-macing-double-amputee-confiscating-his-legs-in-graphic-video/, https://exchange.umma.umich.edu/resources/25677/view, https://www.washingtonpost.com/archive/lifestyle/2006/01/29/a-19th-century-doctor-38/b7534292-bdce-45f0-b5e0-c01ec647bcc9/, https://www.montgomeryadvertiser.com/story/news/local/alabama/2018/05/10/sims-statue-state-capitol-has-go-senator-says/597564002/, https://www.historiccolumbia.org/tour-locations/monument-dr-j-marion-sims, https://www.truthorfiction.com/were-four-busloads-of-protesters-or-antifa-in-ada-oklahoma-met-by-600-armed-americans-and-the-news-wont-report-it/, https://www.truthorfiction.com/category/fact-checks/politics/, https://www.truthorfiction.com/author/art/, https://www.facebook.com/share.php?u=https%3A%2F%2Fwww.truthorfiction.com%2Fj-marion-sims-painting-alabama-capitol%2F, https://api.whatsapp.com/send?text=https%3A%2F%2Fwww.truthorfiction.com%2Fj-marion-sims-painting-alabama-capitol%2F, https://www.truthorfiction.com/category/fact-checks/, https://twitter.com/intent/tweet?text=Is+There+a+Painting+of+J.+Marion+Sims%27+Experiments+on+Black+Women+at+the+Alabama+State+Capitol%3F&url=https%3A%2F%2Fwww.truthorfiction.com%2Fj-marion-sims-painting-alabama-capitol%2F&via=erumors, https://www.reddit.com/submit?url=https%3A%2F%2Fwww.truthorfiction.com%2Fj-marion-sims-painting-alabama-capitol%2F",false,"Fact Checks, Politics"
