claim_id,claim,date_published,explanation,fact_checkers,main_text,sources,label,subjects
24601,"The Democrat-backed health care reform plan ""will require (Americans) to subsidize abortion with their hard-earned tax dollars.","August 7, 2009",Boehner says Democrats' health care plan would subsidize abortions,Robert Farley,"In an already contentious health care debate, the last thing the Obama administration wants is a fight over abortion. The word ""abortion"" was never mentioned in the initial health care plans released by the House and Senate. The decision of whether to offer abortion coverage in the proposed public plan, then, would be left up to the health and human services secretary. Abortion opponents said that would allow Democrats to slip abortion into the plan as part of the standard coverage. In an op-ed piece on July 23, House Republican Leader John Boehner of Ohio repeated the concerns of many who oppose abortion that the Democratic-backed health care reform plan ""will require (Americans) to subsidize abortion with their hard-earned tax dollars."" Although there are several versions of the health care bill kicking around in Congress, one thing has now become clear: Most envision a government-run health plan option that could include abortion coverage, as well as a health care exchange in which participating private insurance companies would be permitted to offer such coverage. But does that mean that federal tax dollars would be used to subsidize abortions? That's a more difficult question. Let's back up a minute and explain some background: Currently, the 1976 Hyde Amendment prohibits the use of federal funds for abortions through Medicaid except in cases of rape, incest or when the mother's health is in peril. So states that want to offer abortion coverage have to pay for it themselves. Similar restrictions on public funding for abortions applies to federal health care coverage extended to active and retired military and federal employees. President Barack Obama gave a nod to that precedent when asked in a July 21 CBS interview with Katie Couric whether he favored a government option that would cover abortions. Obama said, ""As you know, I'm prochoice. But I think we also have a tradition of, in this town, historically, of not financing abortions as part of government-funded health care. Rather than wade into that issue at this point, I think that it's appropriate for us to figure out how to just deliver on the cost savings, and not get distracted by the abortion debate at this station."" Abortion opponents had hoped similar restrictions to those in the Hyde Amendment would be placed on any government-run health care option, and also be extended to any private insurance companies that participate in the government-sponsored health care exchange, which will provide health insurance for people who don't get it through their employer. To that end, Rep. Bart Stupak, D-Mich., offered an amendment to the House health care proposal that would prohibit the use of public money ""to cover any part of the costs of any health plan that includes coverage of abortion."" The amendment was narrowly defeated. Donna Crane, policy director for NARAL Pro-Choice America, called Stupak's proposal a ""radical departure from the status quo,"" because millions of women who currently have private insurance plans that cover abortions would be stripped of that coverage if their plan ultimately became part of the exchange — which seems likely. According to a 2002 Guttmacher Institute study, 87 percent of employment-based insured health plans offered coverage for abortions (though not all companies select it for their employees). A 2003 Kaiser Family Foundation survey found that 46 percent of covered workers had coverage for abortions. The two surveys asked different questions, but the bottom line is that a significant percentage of women currently have health insurance that covers abortions. And so began the debate over how to make the health care reform bill ""abortion neutral."" A compromise plan offered by Rep. Lois Capps, D-Calif., which passed the House Energy and Commerce Committee, seeks to alleviate many of the concerns expressed by abortion opponents — particularly the issue of tax dollars being used to subsidize abortions — while specifically making abortion coverage available in both the public plan and in private plans participating in the exchange. Under the Capps amendment: • Abortion coverage would not be part of the required minimum benefits package. In other words, insurers would not be required to offer, or be prohibited from offering, abortion services in order to participate in the exchange. • The public plan could include abortion coverage, but the cost of the additional coverage could not be paid through public subsidies (tax dollars), only through the premiums paid by the insured. And with private plans in the exchange, again, federal subsidies could not be used for abortion coverage. • Public funding would only be permitted for abortions allowed under the Hyde Amendment — in cases of rape, incest or when the mother's life is in danger. • At least one plan in every region must offer full abortion coverage; and one must not. • Any insurance plan participating in the exchange cannot discriminate against hospitals or other health care facilities (such as Catholic hospitals) that are unwilling to provide abortions. • The plan will not pre-empt any state laws regarding abortion, such as parental notification laws. Douglas Johnson, legislative director for National Right to Life, said the amendment is hardly a compromise, and the pledge not to prohibit the use of public funds amounts to little more than symbolic bookkeeping. The Capps amendment may claim to segregate funds used for abortions, he said, but the bottom line is you have the government paying subsidies to people who are then able to obtain abortion coverage. And, he said, ""It's still the government running the whole plan."" ""The government would be participating in the killing of unborn children under the guise of a health care plan,"" Johnson said. But that's not the opinion of all antiabortion groups. Chris Korzen, executive director of Catholics United, which opposes abortion, said his group doesn't want to see an important health care plan derailed by a ""misleading campaign"" that claims the health care plan would mean taxpayer-subsidized abortions. ""The goal should be to maintain the current policies,"" Korzen said. ""That Capps amendment accomplishes just that. It specifically prohibits taxpayers' funding of abortions. It disappoints me that there are people who are still making that claim."" And, he said, ""there's a lot to be happy about,""  including the fact that abortion coverage was not included as part of the required minimum benefits package. Crane said NARAL believes abortion should be treated like any other health service. But they think the Capps amendment at least maintains the status quo, and that it helped to alleviate many of the concerns expressed by abortion opponents. ""We thought they got everything they wanted,"" Crane said. ""We are confused why they continue to push."" Obviously, there's a lot at stake in the health care bill for both sides in the abortion debate. The fact that several versions of the health care reform bill are floating around Congress makes it difficult to say with certainty what the final plan will or will not include. But while it appears likely the plan would allow for the coverage of abortions, we don't see anything in the plans that would require taxpayers to foot the bill for that. In fact, in a key version of the bill — the one passed by the House Energy and Commerce Committee — members went to great pains to include an amendment to ensure that federal money is not used for abortion coverage. Again, things could change as the health reform package works its way through Congress, but for now, we don't see anything to support Boehner's claim that taxpayers would subsidize abortions. And so we rule his statement .","https://www.guttmacher.org/pubs/psrh/full/3607204.pdf, https://www.time.com/time/politics/article/0,8599,1909178,00.html, http://healthcare.nationalreview.com/post/?q=NGI1YjEwOTNjYmMzODBiYjJkNjliOTljODk2ZTBjOGE, http://energycommerce.house.gov/Press_111/20090730/hr3200_capps_1.pdf, https://news.yahoo.com/s/ap/20090805/ap_on_go_co/us_health_care_overhaul_abortion, http://edlabor.house.gov/documents/111/pdf/publications/AAHCA-BillText-071409.pdf, http://politicalticker.blogs.cnn.com/2009/07/29/frc-spot-looks-to-tie-public-option-to-abortion-funding/, https://www.nytimes.com/2009/07/31/us/politics/31health.html?_r=2, https://www.cbsnews.com/blogs/2009/07/21/politics/politicalhotsheet/entry5178972.shtml, http://www.kff.org/insurance/ehbs2003-1-set.cfm, https://factcheck.org/2009/07/surgery-for-seniors-vs-abortions/, http://help.senate.gov/BAI09A84_xml.pdf, http://www.nrlc.org/AHC/Index.html, https://www.guttmacher.org/statecenter/spibs/spib_RICA.pdf, http://www.catholics-united.org/?q=node/265, https://www.guttmacher.org/media/inthenews/2009/07/22/index.html, https://news.yahoo.com/s/ap/20090722/ap_on_go_co/us_health_care_overhaul_abortion, http://www.prochoiceamerica.org/issues/abortion/access-to-abortion/health-care-reform.html, https://www.guttmacher.org/pubs/gpr/10/1/gpr100112.html, http://www.politico.com/news/stories/0709/25475.html",false,"Abortion, National, Health Care, Taxes, John Boehner, "
17569,Rhode Island’s teen binge drinking rate is double the national average.,"December 22, 2013","Regardless of your opinion on the larger point, the Physicians Committee for Responsible Medicine sought to make it with an incorrect comparison. It claimed ""Rhode Island’s teen binge drinking rate is double the national average,"" deriving that claim by comparing numbers from two different surveys. But the most recent report that includes both national and state-by-state figures show that Rhode Island’s rate was actually less than the national average. We rule the claim False. (To check our sources and find additional information, go to the extended version of this article at PolitiFactRI.com.)",John Hill,"Rhode Island was treated to an interesting do-the-ends-justify-the-means debate last week when the Washington, D.C.-based Physicians Committee for Responsible Medicine criticized a research study by Rhode Island Hospital and Brown University that uses young pigs to study the effects of alcohol consumption on the heart. Besides objecting to the treatment of the animals involved, the committee argued that the money spent on such research could be better used elsewhere in the Ocean State. To drive that point home, the committee has begun an advertising campaign with posters on five Providence bus shelters, claiming ""Rhode Island’s teen binge drinking rate is double the national average. But Brown researchers are not helping teens. Instead, they are wasting federal funds on experiments giving alcohol to piglets."" We’ll pass on whether getting pigs drunk is a waste of federal money. But we wondered whether Rhode Island’s rate of teen binge drinking is that high. Two federal agencies that track teenage alcohol use, the Substance Abuse and Mental Health Services Administration and the Centers for Disease Control and Prevention, define binge drinking as having five or more drinks at the same occasion, at the same time or within a couple of hours. Physicians Committee spokeswoman Jeanne S. McVey said the group came up with its statistic by using data from two federal agencies that track, among other things, alcohol use by the nation’s teenagers. She cited a 2012 survey by the federal Substance Abuse and Mental Health Services Administration that found that 7.2 percent of respondents aged 12 to 17 nationwide reported at least one instance of binge drinking over the previous 30 days. But that study didn’t break down its findings by state. For a Rhode Island number, McVey said, the committee turned to a 2013 survey by the federal Centers for Disease Control and Prevention, called the Youth Risk Behavior Surveillance Study, a survey of a cross section of the nation’s high school students, done every two years. According to documents posted on the state Health Department website, that survey found that in Rhode Island, 15.1 percent of responding students in grades 9 through 12 said they had at least one binge-drinking experience in the previous 30 days. Rhode Island’s 15.1 percent, as reported in the CDC study, is more than twice the national average of 7.2 percent, as reported in the SAMHSA study, McVey said. But those are numbers from two different studies. Is it legitimate to compare them in that way? No, said statistician Jeffrey E. Jarrett, a professor of finance decision science at the University of Rhode Island. To be valid, Jarrett said, comparisons must be drawn from the same data -- in other words, surveys that ask the same questions to the same people. Even a slight difference in wording between questionnaires can make a difference. ""The only way to compare is to compare things within the same study,"" he said. To get an apples-to-apples comparison, we returned to the CDC study. The agency has not yet compiled national averages for its 2013 study. But in its 2011 survey, the Rhode Island teen binge-drinking rate was 18.3 percent, compared with 21.9 percent for the nation as a whole. So the Rhode Island rate was actually less than the national one, not double. When we pointed out the flaws in the committee’s methodology, McVey acknowledged that the organization could have been more careful. ""We now see that we should have had an expert in statistics double check, because we were comparing one set of national statistics to one set of local statistics,"" McVey said. "" … If we were to do it over again, we would certainly word it differently."" ""Our larger point is true,"" she added. ""Federal funds should go to helping people rather than to animal experiments that often do not result in treatment for human patients."" Our ruling Regardless of your opinion on the larger point, the Physicians Committee for Responsible Medicine sought to make it with an incorrect comparison. It claimed ""Rhode Island’s teen binge drinking rate is double the national average,"" deriving that claim by comparing numbers from two different surveys. But the most recent report that includes both national and state-by-state figures show that Rhode Island’s rate was actually less than the national average. We rule the claim . (To check our sources and find additional information, go to the extended version of this article at PolitiFactRI.com.)","http://apps.nccd.cdc.gov/youthonline/App/Results.aspx?TT=G&OUT=0&SID=HS&QID=QQ&LID=RI&YID=2011&LID2=XX&YID2=2011&COL=&ROW1=&ROW2=&HT=QQ&LCT=&FS=1&FR=1&FG=1&FSL=&FRL=&FGL=&PV=&C1=RI2011&C2=XX2011&QP=G&DP=1&VA=CI&CS=N&SYID=&EYID=&SC=DEFAULT&SO=ASC&pf=1&TST=True, http://www.health.ri.gov/materialbyothers/yrbs/2013HighSchoolSummaryTables.pdf, http://www.cdc.gov/mmwr/PDF/ss/ss6104.pdf, http://www.samhsa.gov/data/NSDUH/2012SummNatFindDetTables/DetTabs/NSDUH-DetTabsSect2peTabs37to46-2012.pdf, https://pcrm.org/media/news/ads-slam-alcohol-experiments-on-live-animals",false,"Alcohol, Rhode Island, Children, Crime, Public Health, Public Safety, Physicians Committee for Responsible Medicine, "
590,New Delhi declares public emergency as pollution at year's worst.,"March 30, 2016",Authorities in New Delhi declared a public health emergency on Friday and closed schools and all construction activity until next week as air pollution in the city hit its worst level this year.,Neha Dasgupta,"A thick haze has hung over the Indian capital this week caused by plumes of toxic smoke from farm fires raging in neighbouring states. An index measuring the level of a deadly air pollutant hit 484 on a scale of 500 on Friday, the government’s Central Pollution Control Board, the worst this year. The index measures the level of PM 2.5, tiny particulate matter that goes deep into the lungs. Anything above 400 poses a risk for people with respiratory illnesses and can also affect even those with healthy lungs. Some companies advised employees to avoid exposure to toxic air and work from home. “We have been advised to stay at home on Monday,” said Anuj Rawat, an account director at Kantar, the market research arm of British advertising major WPP. Kantar employs around 400 people at its office in New Delhi, Rawat said. The Environment Pollution Control Authority, which is leading the effort to tackle Delhi’s pollution, said: “We have to take this as a public health emergency as air pollution is now hazardous and will have adverse health impacts on all, but particularly our children.”  It banned all construction work in the sprawling metropolis of 20 million people and its neighbouring cities until Nov. 5. Each year, farmers in the states of Punjab and Haryana burn crop residue to prepare for the sowing season, ignoring  government warnings. According to government-run monitor SAFAR, satellite pictures had captured nearly 3,200 incidents of stubble burning on Thursday in Haryana and Punjab that contributed to 44% percent of Delhi’s pollution. Delhi Chief Minister Arvind Kejriwal offered free masks on Friday and ordered schools shut till Nov. 5 to protect children. The toxic air has left several Bangladeshi cricket players with sore throats and itchy eyes ahead of their Twenty20 match against India on Sunday. “Government knew an emergency situation was approaching and did not take substantive steps on stubble burning or big industrial polluting sources,” said Sunil Dahiya, an energy and air pollution analyst at Greenpeace. “A public health emergency situation began at least 10 days ago.”",/article/us-india-pollution-cricket/itchy-eyes-sore-throat-but-bangladesh-ok-with-delhi-air-idUKKBN1XB41J,true,Environment
2581,"Sun, sand and root canal: Medical tourism booms in Costa Rica.","November 26, 2012","When Canadian house cleaner Marlene Trithardt needed a tooth replaced, she drove past her local dentist’s office in Alberta and flew to the beach paradise of Costa Rica - to save money.",Isabella Cota,"Trithardt is one of a growing number of North Americans who turn south for medical care lured by lower prices, contributing close to 0.8 percent of Costa Rica’s gross domestic product. “I chose to come here because I find in Alberta the prices are about 80 percent higher than in Costa Rica,” says Trithardt, 57, who makes $30,000 a year. Her treatment will cost $4,000. But even including airfare, hotels and meals for two weeks, the total amount is lower than the $10,000 she said she was expecting to pay for the dental care alone in Canada. In the bargain, Trithardt got to take a few days to visit Costa Rica’s national parks. Around 40,000 medical tourists visited Costa Rica last year, compared to 36,000 in 2010 and 30,000 in 2009. Most of them are American and Canadian, according to the country’s tourism institute, ICT. Of that number, almost 15,000 of them traveled for dental care, said Massimo Manzi, director at Promed, the council for international promotion of medicine in Costa Rica. Manzi estimates that medical tourism brought in $196 million to Costa Rica’s health industry in 2011, with patients spending an additional $84 million in hotels, meals, travel and shopping. That makes for a total of $280 million spent on medical tourism in 2011, compared to $252 million in 2010. Costa Rica competes for medical tourists with the likes of India, Brazil, Panama and Mexico, and its proximity to the United States gives it an advantage over Asian and South American destinations. And while some doctors in the United States discourage traveling abroad for cheaper treatment - saying the quality may not be vetted and that follow-up care is lacking - technology and care standards in the private sector are perceived by the medical community and patients alike to be high. The dental tourism niche is booming in Costa Rica, a country of 4.5 million people best known for its white sand beaches and lush rainforests. Now accounting for 36 percent of all medical tourism, that figure is seen rising to 50 percent over the next two years, said Promed’s Manzi. Trithardt’s doctor, 32-year-old Costa Rican Ignacio Vargas, says tourists represent 70 percent of his business. Virtually all medical tourists are uninsured and pay their own way, said Brad Cooke, head of Medical Tours Costa Rica, a travel agency that works exclusively with patients. As a result, healthcare reform passed in the United States that will require Americans to get basic insurance by 2014 could reduce demand. However that reform does not cover dental care. “We had a gentleman, for example, who was interested in coming in for a knee procedure about six months ago and then he decided not to come. He said he’d rather wait and see if Obamacare would cover it”, said Cooke. A few insurance companies in the U.S. like Cigna Corp, Satori and Blue Cross Blue Shield are already expanding their supplier network to include overseas clinics and facilities to help cut costs. “What we’re hoping, and it would be an important step, is that these insurance companies offer an incentive to those who choose the international option,” Manzi said. Costa Rican health officials are grappling with booming demand as it is. “We are learning how to handle this demand so that we don’t get to a point where we are facing waiting periods which would turn patients away from Costa Rica,” said Health Minister Daisy Corrales. To help ensure that demand can be met, Promed works as a guide for investors looking to build new clinics and hospitals that can welcome tourist-patients."," ",true,Health News
1541,"Raised for meat in South Korea, dogs head for new homes in U.S.","January 10, 2017","“You’re OK, you’re OK,” Lola Webber, a campaign manager with the Humane Society International (HSI), whispers to a lab-mix puppy, cradling her in a jacket as dozens of dogs bark in nearby cages.",Nataly Pak,"The puppy is moved from a rusty cage on a dog-meat farm in South Korea to a plastic crate, given the name Demi, and placed in a truck where she begins the long journey to a shelter in Pittsburgh, Pennsylvania, to be put up for adoption. “As soon as they’re ready for adoption, we find that there are line-ups of people - literally people would line up at shelters - in the U.S. to adopt these dogs because people are so engaged by their sad and compelling stories,” said Andrew Plumbly, another campaign manager for the HSI. Demi was one of 10 dogs rescued on Tuesday from a farm in Wonju, 90 km (55 miles) from the South Korean capital, Seoul,  where 200 dogs were being raised for human consumption, to start new lives as pets under the HSI’s campaign. The farm is the sixth that the group has helped close down in South Korea since 2015, and follows six-months of negotiations, medical examinations and vaccinations. Because airline flights can only carry a limited number of dogs a day, it will take a couple of weeks for HSI to rescue all 200 of the dogs at the farm. Hygiene there is “non-existent”, Plumbly said, with waste collecting beneath cages where dogs are exposed to extremes of weather and fed once a day, according to HSI. The owner of the farm, who has been in the business for 30 years and declined to be identified, cited poor health as a reason for getting out of the business. Consumption of dog meat is on the decline in South Korea, where it is mainly eaten by older people and dogs are increasingly popular as pets. Still, HSI estimates there are 17,000 dog-meat farms in the country. Humane Society International hopes the government will ban the breeding of dogs for meat ahead of the 2018 Winter Olympics to be held in South Korea. Recently, the mayor of the city of Seongnam, Lee Jae-myung, who is running for president, ordered the closure of a big dog-meat section of a city market. Seafood will be sold there instead."," ",true,Environment
