claim_id,claim,date_published,explanation,fact_checkers,main_text,sources,label,subjects
34656, A baby died at an unnamed medical facility because its parents refused to allow a black nurse to care for the child.,"November 10, 2015","Fellow Twitter users suggested @FierceFemtivist indicated she was from Louisville, Kentucky, prior to deleting her account. We were unable to locate any news reports of unusual infant deaths on 8 November 2015 in that area, nor were we able to confirm that the purported incident took place in Louisville (or at all):",Kim LaCapria,"On 8 November 2015, former Twitter user @FierceFemtivist published an alarming series of tweets about purportedly racist parents who allowed their child to die rather than be treated by “n***** nurses.” The tweets in question, besides appearing on Twitter (cached partially here), were circulated via Facebook and Tumblr and are embedded in full below. According to @FierceFemtivist, she “just had an infant die” that she personally “could’ve saved” because the child’s epithet-slinging, Confederate flag-bedecked father purportedly physically blocked the nurse from entering the baby’s room despite the fact that the infant was “crashing fast.” @FierceFemtivist claimed to be the most qualified caregiver in the facility but did not provide a date, facility name, medical condition, nor even a gender for the baby who purportedly died solely because it had racist parents. The child appeared merely as a footnote to the narrative of neatly-packaged racism, replete with a Confederate-flag wearing, stock redneck character. Even after the baby’s preventable death, @FierceFemtivist described its parents as unmoved by grief and simply concerned with whether a black staff member might handle the infant’s corpse. No response on the part of the hospital or other medical staffers during the critical event was described in the story; as presented, the narrative reads like the facility passively allowed a baby to die during an unspecified cardiac event for the sole reason that the parents objected to a nurse’s race (despite the fact that hospitals and Child Protective Services maintain broad protocols for such emergency interventions). The form of sure life-saving care which could only have been be rendered by that one nurse (and apparently no other on-duty caregivers) wasn’t specified in the account. Readers were left with a number of questions when @FierceFemtivist deleted her account (and along with it, the controversial tweets). Did the incident occur on 8 November 2015, the date the tweets were posted, or earlier? Where was the facility located? Why did no other nurses or doctors intervene and attempt to administer life-saving care, even if they weren’t as capable of doing so? Were police summoned to investigate the baby’s death? What was the condition and ultimate cause of death? Was the baby male or female? Were any adults (parents or medical staff) considered potentially liable for the purported death?","http://webcache.googleusercontent.com/search?q=cache:ayn0Ddl2o8sJ:https://twitter.com/fiercefemtivist+&cd=1&hl=en&ct=clnk&gl=us, http://pediatrics.aappublications.org/content/120/6/1385, http://seananmcguire.tumblr.com/post/132867210710/feelingwomanish-vngelichoe-he-didnt-want-a, https://www.snopes.com/tachyon/2015/11/fiercefemtivist10.jpg",unproven,"Politics, fiercefemtivist, racism"
3632,Bat from Shawnee County tests positive for rabies.,,A bat found in northeastern Kansas has tested positive for rabies.," ","Topeka television station KSNT reports that the bat was found in Shawnee County. The Shawnee County Health Department is urging residents to be aware of the signs and symptoms of rabies and the steps to take if exposed. Rabies is a fatal but preventable viral disease that is typically transmitted by raccoons, bats, skunks and foxes. Health officials those who suspect they’ve been exposed to the disease should seek immediate medical treatment. Once a person begins to exhibit signs of disease, survival is rare. Symptoms include general weakness or discomfort, fever or headache and progress to confusion, agitation and delirium. ___ Information from: KSNT-TV.",https://www.ksnt.com/news/bat-tests-positive-for-rabies-in-shawnee-county/,true,"Rabies, Health, General News, Kansas, Bats, Topeka"
29558,Germany has banned pork from school canteens because it offends Muslim 'migrants.',"March 7, 2016","What's true: Some politicians complained that less pork was being served in Germany, diluting the country's culinary cultural heritage. What's false: Germany has banned pork in any way, shape, or form.",Kim LaCapria,"On 7 March 2016, British tabloid Express reported that some German cafes and schools were phasing out pork products. The headline (“GERMANY BANS SAUSAGES”) naturally made some readers infer that the country had banned pork entirely. The article itself described a less alarming scenario, in which a single politician said that pork was slowly disappearing from schools and cafeterias, and extrapolating that it was because Muslims were possibly objecting to its presence: SCHOOLS and canteens in Germany have BANNED pork from their menus over fears of offending Muslim migrants, a top politician has revealed. An increasing number of public canteens, child daycare centres and schools have stopped serving sausages, bacon and ham over religious considerations. Now members of Chancellor Angela Merkel’s CDU party are fighting to keep pork on the menu, insisting the consumption of pork is part of German culture. Daniel Günther, party representative, claimed that pork products were being taken off the menu in schools, nurseries and canteens across the country. He said: “The protection of minorities – including for religious reasons – must not mean that the majority is overruled in their free decision by ill-conceived consideration. The paper surmised such a “move” would deepen resentment over immigration in Germany, without specifying precisely what, exactly, was moving: The move is likely to cause tensions among residents who support the introduction of restrictions on the inflow of refugees to the country. At around the same time, readers also asked about a Daily Mail piece making a similar claim about pork, reporting that schools in a locality in England (not Germany) were replacing pork with “halal meat”: Parents have condemned a school’s decision to ban all pork products from the menu and replace other meats with halal versions. Pupils aged between three and 11 at Brinsworth Manor Infant and Junior Schools in Rotherham – which Ofsted identifies as having only a small number of pupils from minority ethnic groups – will no longer be able to enjoy sausages, bacon or ham. Parents at both schools, which share a site, were told of the decision in a letter from Rotherham Council’s principal catering officer Ron Parry, who wrote that there had been ‘minor adjustments’ to the lunch menu. While many thought this article came out around the same time as the Germany one, it was actually already two years old (from 7 March 2014), and concerned one particular area in England, not Germany. That story also contained the following reportage, which appeared to partially contradict its initial claims: The school governors at both schools are understood to have agreed to the menu change to ensure the meals are more inclusive. A spokesman for Rotherham Borough Council confirmed that school meals at both Brinsworth Manor schools have changed and now include halal and non-halal meat on the menu. She added that the Schools Catering Service supplies about 17,000 school meals every day to children at infant, junior, primary and secondary schools in Rotherham. She said: ‘The provision of both halal and non-halal is not unusual in Rotherham’s school. Currently, nine schools out of 115, select one of our menus that provide a mix of both halal and non-halal meals. ‘All meat on our menus, including halal, is sourced from reputable companies, which fully comply with the quality standards of the relevant individual meat boards.’ At any rate, the “pork ban” didn’t last even last until the end of March 2014; it was soon reversed, mostly due to pressure by far-right and nationalist political groups. On 1 March 2016, news outlet Deutsche Welle covered the matter of Germany’s vanishing pork. According to that report, politician Daniel Günther had complained about what he perceived as a decreased number of pork-based items on cafeteria menus: CDU parliamentary group leader, Daniel Günther, bemoaned on Tuesday that an increasing number of canteens, nurseries and schools are removing pork from their menu due to religious considerations. “The protection of minorities – including for religious reasons – must not mean that the majority is overruled in their free decision by ill-conceived consideration,” Günther said, arguing that tolerance also means “the appreciation and sufferance of other food cultures and lifestyles.” Günther told local German newspaper “Lübecker Nachrichten” that at least one nursery in every voting district had stopped serving pork after taking Muslim children into consideration. “The consumption of pork belongs to our culture,” he argued, adding that those who didn’t want to eat pork didn’t have to. “No one should be obliged to do so,” he said. “But we also don’t want the majority having to refrain from pork.” Deutsche Welle also provided more contextual information. According to its article, many Germans mocked the initiative and felt it was completely without merit: The CDU’s proposal was met with a wave of mockery on Tuesday, particularly on Twitter where the hashtag #schweinefleischpflicht – meaning “pork duty” – became Germany’s top trending hashtag by late Tuesday afternoon. Accompanied with an image with the words “Wurst case scenario” – wurst being the German word for sausage – Germany’s Green party tweeted: “Now we finally know what the CDU meant with dominant culture.” The WWF in Berlin also criticized the CDU proposal. “At present there is little evidence that the pork cutlet and chop must be placed on the menus of German canteens as a protected species,” the wildlife protection organization quipped. The exaggerated claims about pork bans in Germany weren’t the first of their kind to appear in British media sources. An October 2015 press frenzy centered around purported bans on pork in UK offices (nothing was banned), and in June 2015 the Daily Mail claimed Muslims demanded someone’s grandfather be exhumed (again, false). In 2014 claims circulated that KFC banned hand wipes because they were prohibited by Islam (they weren’t), and around the same time a questionable story made the rounds about a couple booted from a bus for offending Muslims by singing the theme song to Peppa Pig. While it was true one or (at most) a few German politicians “bemoaned” what they believed was a disappearing presence of pork in school cafeterias, misleading headlines indicated that there was a “ban on pork”. Finally, a number of Germans mocked the assertions as ludicrous and baseless.","http://bnp.org.uk/news/regional/bnp-victory-brinsworth-rotherham, http://www.snopes.com/politics/religion/peppapig.asp, http://www.snopes.com/dead-grandfather-offends-muslims/, http://www.dailymail.co.uk/news/article-2575724/Parents-fury-pork-sausages-banned-school-menu-replaced-halal-meat.html, http://www.snopes.com/politics/religion/kfcwipes.asp, http://www.express.co.uk/news/world/650246/Germany-bans-pork-cafes-schools-offending-Muslim-migrants, http://www.dw.com/en/schleswig-holstein-cdu-fights-to-keep-pork-on-canteen-menus/a-19085870, http://www.snopes.com/offices-ban-pork-muslims/",false,Politics
8416,Coronavirus prompts Canada to roll out safe drugs for street users.,"April 16, 2020","Canada’s Pacific province of British Columbia was already battling an opioid epidemic when the new coronavirus hit, compounding the threat to drug users, many of whom are homeless and particularly vulnerable during the pandemic.",Tessa Vikander,"In March, the Canadian government urged provinces to lower barriers to prescription medications - allowing doctors to provide prescriptions for controlled substances by phone and  pharmacists to deliver them - to better help citizens to practice physical distancing and self-isolation. B.C. is the first province to apply those guidelines to support people who use street drugs. Healthcare providers are  ramping up the supply of prescription drug replacements for those who live with addictions to drugs like heroin, and even dispensing some of them via unique vending machines. “We’ve taken these exemptions and we’re running with them at break-neck speed,” said Judy Darcy, provincial Minister of Mental Health and Addictions. The goal is to “bring down the number of people who are dying of overdose,” she said. The Downtown Eastside is where the majority of Vancouver’s homeless population resides. In 2019, the city had 2,223 homeless residents, about a third of whom live with opioid or methamphetamine addictions. By providing a safe supply of legal drug alternatives, the province hopes to lower a sudden spike in drug overdose deaths that coincided with the coronavirus outbreak in Vancouver. Overdose deaths in the city had been declining over the  past year with implementation of safe consumption sites and availability of naloxone overdose reversal kits. But between March 23 and 29, police in Vancouver responded to eight suspected overdose deaths, the most in a single week since August 2019. The following week, they attended eight more. Cheyenne Johnson, co-interim executive director at the B.C. Centre on Substance Use, said the region’s illicit drug supply was already tainted. The coronavirus closure of the border with the United States has exacerbated the problem by stymying illegal drug supply routes, prompting dealers to increasingly make or cut their wares with dangerous ingredients. “As the effects of the pandemic continue to unfold, the illicit drug supply is likely to become significantly more adulterated and toxic,” Johnson said. Before the new guidelines came into place, some people were able to access prescription drug replacements through special programs. In most instances, they had to get the medication from a pharmacy every day. For people using the highly potent opioid fentanyl or heroin on the street, doctors can provide the prescription opioid hydromorphone along with methadone. Dexedrine or Ritalin are  available to people who would otherwise be using cocaine or crystal meth. Days after the new guidelines were rolled out, Rupinder Brar, a physician at Vancouver’s Portland Hotel Society, said she has provided prescriptions for free drug replacements, which can be dispensed by the week. This gives her patients “a fighting chance” as supplies of illicit street drugs dwindle, along with sharply reduced opportunities to make income at a time of coronavirus shutdowns and social distancing measures. “I don’t want them to have to go to the pharmacy every day,” Brar said. Another option are specialized vending machines called MySafe. Conceived in response to the opioid crisis, they dispense drug replacements with a prescription, bypassing the need for a face-to-face interaction with a pharmacist. At the corner of Vancouver’s Main and Hastings streets, a typically busy intersection in a neighborhood where hawking pills is common, some sections of the sidewalk were virtually empty in early April. Chrissy McMullin, a Downtown Eastside resident who uses drugs, already takes opioid replacements and said she had no trouble getting a hydromorphone prescription under the new guidelines. McMullin, who lost her brother in October to an overdose, is upset it took a global pandemic to prompt access to safe drugs. “It’s a real kick in the gut, to see how quickly and easily (it got put in place),” McMullin said. “Now all of a sudden what we’ve been trying to get for years is made available.”"," ",true,Health News
7169,"Wayne National Forest plans fires for tree, wildlife health.",,"Nearly 2,000 acres of Wayne National Forest in Ohio will be intentionally burned over the next three months as part of the area’s fire management efforts."," ","Forest officials say scientists who study native plants, birds and other wildlife believe prescribed fire helps maintain healthy oak forests. They say controlled blazes help increase nutrient availability in the forest and remove some leaf litter and smaller trees and brush. That, in turn, allows more sunlight to reach the forest floor to regenerate oak and hickory trees and sun-loving plants. Officials say 1,710 acres are scheduled for controlled burns during March, April and May on the southern Ohio forest’s Ironton Ranger District. The forest supervisor says prescribed burns follow strict guidelines and take place only under specific weather conditions."," ",true,"Plants, Wildlife, Health, Wildlife health, Forests, Trees, Fires, Ohio, Controlled burns"
8602,"School closures will have little impact on COVID-19 control, review finds.","April 6, 2020","School closures do not tend to help contain the spread of infections during outbreaks of disease such as COVID-19, but will have a big impact on how societies restart after lockdown, scientists said on Monday.",Kate Kelland,"Data on the effects of school closures on COVID-19 are limited as the pandemic is still under way, but researchers at University College London said evidence from flu epidemics and outbreaks caused by other coronaviruses suggests their impact on the spread of the disease will be small. “We know from previous studies that school closures are likely to have the greatest effect if the virus has low transmissibility and attack rates are higher in children. This is the opposite of COVID-19,” said Russell Viner, an expert at UCL’s Great Ormond Street Institute of Child Health who co-led the research. “Policymakers need to be aware of the equivocal evidence when considering school closures for COVID-19 given the profound and long lasting effect they will have on children - particularly the most disadvantaged,” he said. Millions of children around the world have been affected by school closures as governments introduced social distancing and lockdown measures to try to slow the COVID-19 pandemic caused by the new SARS-COV2 coronavirus. Viner’s research, published late on Monday in The Lancet Child & Adolescent Health journal, said that as of March 18, some 107 countries had implemented national schools closures. To analyze the potential impact, Viner’s team reviewed 16 previous studies, including nine which looked at school closures during the 2003 outbreak of Severe Acute Respiratory Syndrome - a respiratory disease caused by a coronavirus similar to the one that causes COVID-19. Data from the SARS outbreak in China, Hong Kong and Singapore suggested school closures “did not contribute to control of the epidemic”, they said in a summary of the review. Experts not directly involved in the research said its findings were important and confirmed what many suspected: That the public health benefits of school closures were not proportionate to the social and economic costs for affected children and families. “This work suggests that ... schools could, and should, begin to reopen as soon as practicable after the initial wave of cases has passed through,” said Robert Dingwall, a professor of sociology at Britain’s Nottingham Trent University. Viner said the findings suggest countries should now “ask hard questions about when and how to open schools”. He said other measures, such as staggering school start and break times, closing school playgrounds and minimising the movement of children between classes could be considered to reduce the risk of COVID-19 spreading."," ",true,Health News
